{
  "id": "337d5e99-287f-4f68-ac95-ed435d7c5797",
  "name": "Standard Merchandise",
  "description": "",
  "lineNumber": 1,
  "invoiceLineType": "Charge",
  "invoiceLineStatus": "Unpaid",
  "salesOrderProductId": "c5fab4e7-f942-415b-8f26-4cbd7104e3ac",
  "fulfillmentOrderProductId": "12ea2ef0-665f-4d96-95f8-6b64fe2f480e",
  "productId": "2ff88028-754b-4ce9-a7e0-4be47c7a1476",
  "productCode": "StdMerch",
  "lineStartDate": "2024-03-01",
  "lineEndDate": null,
  "lineQuantity": 2,
  "unitPrice": 24.50,
  "grossUnitPrice": 26.95,
  "totalAdjustmentAmount": 0.0,
  "totalAdjustmentTaxAmount": 0.0,
  "totalAdjustmentWithTaxAmount": 0.0,
  "totalChargeAmount": 49.0,
  "totalChargeTaxAmount": 4.9,
  "totalChargeWithTaxAmount": 53.9,
  "totalAmount": 49.0,
  "totalTaxAmount": 4.9,
  "totalWithTaxAmount": 53.9,
  "taxCode": "HST",
  "taxName": "Harmonized Sales Tax",
  "taxRatePercent": 10.0,
  "taxEffectiveDate": null,
  "auditInfo": {
    "createdDate": "2023-04-30T17:25:11.128Z",
    "createdBy": "Application Admin",
    "updatedDate": "2023-04-30T17:25:11.128Z",
    "updatedBy": "Application Admin",
    "isDeleted": false
  }
}